unique ID,Project name,Place name[1],Place name[2],Place name[3],project_name_flag
13882,Mexia State School. Supply warehouse.,Mexia State School.Supplywarehouse.,Supplywarehouse,Mexia State School,0
13883,Town Lake Center. Master Plan.,Town Lake Center,,,0
13884,Thomas summer house.,Thomas summer house,,,0
13885,State Bank and Trust. Drive-in bank addition.,State Bank and Trust.Drive-inbank addition.,Drive-inbank addition,State Bank and Trust,0
13886,Guadalupe Blanco River Authority. Technical Services Addition.,Guadalupe Blanco River Authority,,,0
13887,Fair Oaks Ranch. Fair residence. Guest house.,Fair Oaks Ranch.Fair residence. Guesthouse.,Fair residence. Guesthouse,Fair Oaks Ranch,0
13888,Giddings Medical Center.,Giddings Medical Center,,,0
13889,Barnett Jewelry. Remodel.,Barnett Jewelry,,,0
13890,Acme Brick Co. office building.,Acme Brick Co.officebuilding.,officebuilding,Acme Brick Co,0
13891,St Matthews Episcopal Church. Chapel.,St Matthews Episcopal Church.Chapel.,Chapel,St Matthews Episcopal Church,0
13892,Mrs. Robinson’s Greenhouse [restaurant]. Addition.,Mrs.Robinson’s Greenhouse [restaurant].,Robinson’s Greenhouse [restaurant],Mrs,0
13893,Elliott and Tallant clinic.,Elliott and Tallant clinic,,,0
13894,Best Products store.,Best Products store,,,0
13895,Lake Wood Recreation Area. Marina.,Lake Wood Recreation Area,,,0
13896,Bratton residence.,Bratton residence,,,0
13897,Commander’s Point. Townhouses.,Commander’s Point,,,0
13898,Commander’s Point. Tri Plex 1.,Commander’s Point,,,0
13899,Commander’s Point. Tri Plex 2.,Commander’s Point,,,0
13900,Duplex. Preliminary design.,Duplex,,,0
13901,Hamilton Plaza.,Hamilton Plaza,,,0
13902,Tickle residence.,Tickle residence,,,0
13903,Lammes. Proposed neighborhood store.,Lammes.Proposed neighborhoodstore.,Proposed neighborhoodstore,Lammes,0
13904,Leberman (?) residence.,Leberman (?) residence,,,0
13905,San Marcos Telephone Co. Additions and renovations.,San Marcos Telephone Co,,,0
13906,Price residence. Remodeling and additions.,Price residence,,,0
13907,Greenhigh Cottage.,Greenhigh Cottage,,,0
13908,May store building.,May store building,,,0
13909,Sagebiel residence. Alterations and additions.,Sagebiel residence,,,0
13910,Holmes residence. Addition [playroom].,Holmes residence,,,0
13911,Geeslin residence.,Geeslin residence,,,0
13912,Campus Christian Community Student Center.,Campus Christian Community Student Center,,,0
13913,Barclay residence.,Barclay residence,,,0
13914,1000 Man Mess and Administration Building. Preliminary plan.,1000 Man Mess and Administration Building,,,0
13915,Kings Point Condominiums.,Kings Point Condominiums,,,0
13916,Ryan residence.,Ryan residence,,,0
13917,Austin Housing Authority. Project Tex 1-16 [family units].,Austin Housing Authority,,,0
13918,Rockdale State Bank.,Rockdale State Bank,,,0
13919,Commanders Point. Restaurant. Preliminary plan.,Commanders Point.Restaurant.,Restaurant,Commanders Point,0
13920,Commanders Point. Shopping Center.,Commanders Point.ShoppingCenter.,ShoppingCenter,Commanders Point,0
13921,Commanders Point. Inn.,Commanders Point,,,0
13922,Commanders Point. Section Two [townhouses].,Commanders Point,,,0
13923,Bank of Marble Falls.,Bank of Marble Falls,,,0
13924,Town Lake Comprehensive Development Plan.,Town Lake Comprehensive Development Plan,,,0
13925,Citizens State Bank.,Citizens State Bank,,,0
13926,San Marcos Telephone Building. Addition.,San Marcos Telephone Building,,,0
13927,Southwestern Bell West Work Center.,Southwestern Bell West Work Center,,,0
13928,Park Terrace Development.,Park Terrace Development,,,0
13929,Mallard Lane Housing (Proposed FMHA Housing Project).,Mallard Lane Housing (Proposed FMHA Housing Project),,,0
13930,Kings Point Condominiums.,Kings Point Condominiums,,,0
13931,University Savings. Master Plan and parking garage. Proposed.,University Savings.Master Plan and parkinggarage.,Master Plan and parkinggarage,University Savings,0
13932,University Savings. Branch Office. Additions.,University Savings.BranchOffice.,BranchOffice,University Savings,0
13933,Citizens State Bank. Drive-in Facility and Community Room.,Citizens State Bank.Drive-in Facility and CommunityRoom.,Drive-in Facility and CommunityRoom,Citizens State Bank,0
13934,University Savings. Branch office building.,University Savings.Branch officebuilding.,Branch officebuilding,University Savings,0
13935,University Savings. Branch office building.,University Savings.Branch officebuilding.,Branch officebuilding,University Savings,0
13936,San Miguel Condominiums. Permit drawings.,San Miguel Condominiums,,,0
13937,State Bank and Trust. Drive-in facility.,State Bank and Trust,,,0
13938,Episcopal Theological Seminary of the Southwest. Property survey.,Episcopal Theological Seminary of the Southwest,,,0
13939,"Austron, Inc. Headquarters and manufacturing facilities.","Austron, Inc",,,0
13940,Commercial National Bank. Renovations and additions.,Commercial National Bank,,,0
13941,Sutton County National Bank.,Sutton County National Bank,,,0
13942,Citizens State Bank. Additions.,Citizens State Bank,,,0
13943,First United Methodist Church.,First United Methodist Church,,,0
13944,The Other Place. Rental office [headquarters].,The Other Place.Rentaloffice [headquarters].,Rentaloffice [headquarters],The Other Place,0
13945,AusCom headquarters and manufacturing facility.,AusCom headquarters and manufacturing facility,,,0
13946,Rockdale State Bank. Drive in facility.,Rockdale State Bank,,,0
13947,Tower Shopping Center. Highland Professional Building.,Tower Shopping Center.Highland ProfessionalBuilding.,Highland ProfessionalBuilding,Tower Shopping Center,0
13948,Commercial National Bank. Drive-in.,Commercial National Bank,,,0
13949,Fargo Energy Corp. Corporate offices.,Fargo Energy Corp,,,0
13950,State of Texas Supreme Court Buildng. Addition.,State of Texas Supreme Court Buildng,,,0
13951,Kimball residence.,Kimball residence,,,0
13952,Meredith residence.,Meredith residence,,,0
13953,House Beautiful Building Manual.,House Beautiful Building Manual,,,0
13954,Unidentified housing projects [apartments].,Unidentified housing projects [apartments],,,0
